{
  "$schema": "https://desirecore.net/schemas/smart-model-catalog.json",
  "version": 1,
  "updatedAt": "2026-08-09T13:45:49.000Z",
  "source": "config-center",
  "tiers": [
    {
      "id": "flagship",
      "label": "旗舰",
      "labelEn": "Flagship",
      "description": "最高能力，优先用于复杂推理、关键交付和长程智能体任务。",
      "defaultReasoning": "high"
    },
    {
      "id": "balanced",
      "label": "均衡",
      "labelEn": "Balanced",
      "description": "质量、速度与成本平衡，适合大多数日常任务。",
      "defaultReasoning": "medium"
    },
    {
      "id": "lightweight",
      "label": "轻量",
      "labelEn": "Lightweight",
      "description": "优先低延迟与低成本，适合明确、短链路和批量任务。",
      "defaultReasoning": "low"
    }
  ],
  "providers": [
    {
      "providerId": "provider-openai-codex-plan-001",
      "provider": "openai-codex",
      "displayName": "ChatGPT 订阅 (Codex)",
      "models": [
        {
          "model": "gpt-5.6-sol",
          "displayName": "GPT-5.6 Sol",
          "tier": "flagship",
          "routingPriority": 10,
          "serviceTypes": [
            "chat"
          ],
          "capabilities": [
            "chat",
            "reasoning",
            "code",
            "vision",
            "long_context",
            "tool_use",
            "agent"
          ],
          "contextWindow": 1050000,
          "maxOutputTokens": 128000,
          "supportedReasoning": [
            "auto",
            "off",
            "low",
            "medium",
            "high",
            "xhigh",
            "max"
          ],
          "defaultReasoning": "low",
          "eligibleForAgent": true,
          "defaultReference": false
        },
        {
          "model": "gpt-5.6-terra",
          "displayName": "GPT-5.6 Terra",
          "tier": "balanced",
          "routingPriority": 10,
          "serviceTypes": [
            "chat"
          ],
          "capabilities": [
            "chat",
            "reasoning",
            "code",
            "vision",
            "long_context",
            "tool_use",
            "agent"
          ],
          "contextWindow": 1050000,
          "maxOutputTokens": 128000,
          "supportedReasoning": [
            "auto",
            "off",
            "low",
            "medium",
            "high",
            "xhigh",
            "max"
          ],
          "defaultReasoning": "medium",
          "eligibleForAgent": true,
          "defaultReference": false
        },
        {
          "model": "gpt-5.6-luna",
          "displayName": "GPT-5.6 Luna",
          "tier": "lightweight",
          "routingPriority": 10,
          "serviceTypes": [
            "chat"
          ],
          "capabilities": [
            "chat",
            "reasoning",
            "code",
            "vision",
            "long_context",
            "tool_use",
            "fast"
          ],
          "contextWindow": 1050000,
          "maxOutputTokens": 128000,
          "supportedReasoning": [
            "auto",
            "off",
            "low",
            "medium",
            "high",
            "xhigh",
            "max"
          ],
          "defaultReasoning": "medium",
          "eligibleForAgent": true,
          "defaultReference": false
        },
        {
          "model": "gpt-5.5",
          "displayName": "GPT-5.5",
          "tier": "flagship",
          "routingPriority": 60,
          "serviceTypes": [
            "chat"
          ],
          "capabilities": [
            "chat",
            "reasoning",
            "code",
            "vision",
            "long_context",
            "tool_use",
            "agent"
          ],
          "contextWindow": 1050000,
          "maxOutputTokens": 128000,
          "supportedReasoning": [
            "auto",
            "off",
            "low",
            "medium",
            "high",
            "xhigh"
          ],
          "defaultReasoning": "medium",
          "eligibleForAgent": true,
          "defaultReference": false
        },
        {
          "model": "gpt-5.4",
          "displayName": "GPT-5.4",
          "tier": "balanced",
          "routingPriority": 60,
          "serviceTypes": [
            "chat"
          ],
          "capabilities": [
            "chat",
            "reasoning",
            "code",
            "vision",
            "long_context",
            "tool_use",
            "agent"
          ],
          "contextWindow": 1050000,
          "maxOutputTokens": 128000,
          "supportedReasoning": [
            "auto",
            "off",
            "low",
            "medium",
            "high",
            "xhigh"
          ],
          "defaultReasoning": "medium",
          "eligibleForAgent": true,
          "defaultReference": false
        },
        {
          "model": "gpt-5.4-mini",
          "displayName": "GPT-5.4 Mini",
          "tier": "lightweight",
          "routingPriority": 25,
          "serviceTypes": [
            "chat"
          ],
          "capabilities": [
            "chat",
            "reasoning",
            "code",
            "vision",
            "long_context",
            "tool_use",
            "fast"
          ],
          "contextWindow": 400000,
          "maxOutputTokens": 128000,
          "supportedReasoning": [
            "auto",
            "off",
            "low",
            "medium",
            "high",
            "xhigh"
          ],
          "defaultReasoning": "low",
          "eligibleForAgent": true,
          "defaultReference": false
        },
        {
          "model": "gpt-5.3-codex-spark",
          "displayName": "GPT-5.3 Codex Spark（Pro 专属）",
          "tier": "lightweight",
          "routingPriority": 30,
          "serviceTypes": [
            "chat"
          ],
          "capabilities": [
            "chat",
            "code",
            "tool_use",
            "fast"
          ],
          "contextWindow": 128000,
          "maxOutputTokens": null,
          "supportedReasoning": [
            "auto"
          ],
          "defaultReasoning": "auto",
          "eligibleForAgent": true,
          "defaultReference": false
        }
      ]
    },
    {
      "providerId": "provider-anthropic-claude-plan-001",
      "provider": "anthropic-claude",
      "displayName": "Claude 订阅 (Claude Code)",
      "models": [
        {
          "model": "claude-fable-5",
          "displayName": "Claude Fable 5",
          "tier": "flagship",
          "routingPriority": 20,
          "serviceTypes": [
            "chat"
          ],
          "capabilities": [
            "chat",
            "reasoning",
            "code",
            "vision",
            "tool_use",
            "agent",
            "long_context"
          ],
          "contextWindow": 1000000,
          "maxOutputTokens": 128000,
          "supportedReasoning": [
            "auto",
            "low",
            "medium",
            "high",
            "xhigh",
            "max"
          ],
          "defaultReasoning": "xhigh",
          "eligibleForAgent": true,
          "defaultReference": false
        },
        {
          "model": "claude-opus-5",
          "displayName": "Claude Opus 5",
          "tier": "flagship",
          "routingPriority": 25,
          "serviceTypes": [
            "chat"
          ],
          "capabilities": [
            "chat",
            "reasoning",
            "code",
            "vision",
            "tool_use",
            "agent",
            "long_context"
          ],
          "contextWindow": 1000000,
          "maxOutputTokens": 128000,
          "supportedReasoning": [
            "auto",
            "low",
            "medium",
            "high",
            "xhigh",
            "max"
          ],
          "defaultReasoning": "xhigh",
          "eligibleForAgent": true,
          "defaultReference": false
        },
        {
          "model": "claude-sonnet-5",
          "displayName": "Claude Sonnet 5",
          "tier": "balanced",
          "routingPriority": 20,
          "serviceTypes": [
            "chat"
          ],
          "capabilities": [
            "chat",
            "reasoning",
            "code",
            "vision",
            "tool_use",
            "agent",
            "long_context"
          ],
          "contextWindow": 1000000,
          "maxOutputTokens": 128000,
          "supportedReasoning": [
            "auto",
            "low",
            "medium",
            "high",
            "xhigh",
            "max"
          ],
          "defaultReasoning": "xhigh",
          "eligibleForAgent": true,
          "defaultReference": false
        },
        {
          "model": "claude-haiku-4-5",
          "displayName": "Claude Haiku 4.5",
          "tier": "lightweight",
          "routingPriority": 20,
          "serviceTypes": [
            "chat"
          ],
          "capabilities": [
            "chat",
            "code",
            "vision",
            "tool_use"
          ],
          "contextWindow": 200000,
          "maxOutputTokens": 64000,
          "supportedReasoning": [
            "auto"
          ],
          "defaultReasoning": "auto",
          "eligibleForAgent": true,
          "defaultReference": false
        }
      ]
    },
    {
      "providerId": "desirecore-cloud",
      "provider": "desirecore-cloud",
      "displayName": "官方算力",
      "models": [
        {
          "model": "wan2.7-image-pro",
          "displayName": "通义万相 2.7 Pro",
          "tier": "flagship",
          "routingPriority": 100,
          "serviceTypes": [
            "image_gen"
          ],
          "capabilities": [
            "chat",
            "image_generation",
            "chinese_optimized",
            "high_quality"
          ],
          "contextWindow": null,
          "maxOutputTokens": null,
          "supportedReasoning": [
            "auto"
          ],
          "defaultReasoning": "auto",
          "eligibleForAgent": false,